resource_id,title,topic_ids,resource_format,resource_type,year,date_added,date_updated,pdf_upload,pdf_html_url,summary,thumbnail,thumbnail_alt_tag,thumbnail_url,issue_year,keywords
1454,Facilitating Constructive DE&I Conversations in the Workplace (session 1),"3,15,16",pdf,Working Group Summaries,2021,03/08/2021,03/10/2021,46637452-b89d-4c8f-b6f9-6cabe0893a3b.pdf,http://est05.esalestrack.com/eSalesTrack/Content/Content.ashx?file=46637452-b89d-4c8f-b6f9-6cabe0893a3b.pdf,,,DE&I Conversations in the Workplace,http://est05.esalestrack.com/eSalesTrack/Content/Content.ashx?file=,0,"Diversity &amp; Inclusion, Diversity management, Diversity training, Equity, Race/Ethnicity, Justice perceptions "
1495,Addressing Bias in Internal and External Hiring Virtual Working Group Notes,"3,15,16",pdf,Working Group Summaries,2021,03/15/2021,03/15/2021,0cb7b355-aa04-4d8f-b252-82e6ad6dc9d7.pdf,http://est05.esalestrack.com/eSalesTrack/Content/Content.ashx?file=0cb7b355-aa04-4d8f-b252-82e6ad6dc9d7.pdf,,,Addressing bia in internal and external hiring,http://est05.esalestrack.com/eSalesTrack/Content/Content.ashx?file=,0,"Diversity &amp; Inclusion (combine diversity and inclusion), Discrimination, Diversity management, Diversity training, EEO, Equity, Individual Differences, Race/Ethnicity, Justice perceptions, Gender"
1540,"Diversity, Equity & Inclusion Analytics ","3,15,16",pdf,Working Group Summaries,2021,05/19/2021,05/19/2021,96234838-64ed-4f22-b027-6ea2aa2687cb.pdf,http://est05.esalestrack.com/eSalesTrack/Content/Content.ashx?file=96234838-64ed-4f22-b027-6ea2aa2687cb.pdf,,,diversity & inclusion analytics,http://est05.esalestrack.com/eSalesTrack/Content/Content.ashx?file=,0,"diversity management, diversity training, justice perceptions, diversity &amp; inclusion "
1910,Systemic Shifts in Belonging & Inclusion Approaches,"3,15,16",pdf,Working Group Summaries,2023,08/02/2023,08/02/2023,82b159db-55f3-440f-894f-da6480757f13.pdf,http://est05.esalestrack.com/eSalesTrack/Content/Content.ashx?file=82b159db-55f3-440f-894f-da6480757f13.pdf,,,,http://est05.esalestrack.com/eSalesTrack/Content/Content.ashx?file=,0,"Diversity &amp; Inclusion , Discrimination, Diversity management, Diversity training, EEO, Equity, Justice perceptions "
668,The Impact of Internal Hiring Processes on Women's Career Advancement and Pay,"3,15,16,17",pdf,Research Links,2017,01/20/2017,10/07/2019,d54781c3-6848-438b-9e5c-5b1cf05c1940.pdf,http://est05.esalestrack.com/eSalesTrack/Content/Content.ashx?file=d54781c3-6848-438b-9e5c-5b1cf05c1940.pdf,The Impact of Internal Hiring Processes on Women's Career Advancement and Pay ResearchLink,,The Impact of Internal Hiring Processes on Women's Career Advancement and Pay ResearchLink,http://est05.esalestrack.com/eSalesTrack/Content/Content.ashx?file=,0,"internal hiring, sponsorship, formal posting, gender inequality, pay gap, promotion, career path, pay equity, job ladder, gender barrier"
1618,Drawing the Line: How the Workplace Shapes Perceptions of Sexual Harassment,"3,15,16,17",pdf,Research Links,2021,11/17/2021,12/01/2021,a6643db2-0613-4bda-b43a-3b2da22f8db5.pdf,http://est05.esalestrack.com/eSalesTrack/Content/Content.ashx?file=a6643db2-0613-4bda-b43a-3b2da22f8db5.pdf,,,Drawing the Line: How the Workplace Shapes Perceptions of Sexual Harassment,http://est05.esalestrack.com/eSalesTrack/Content/Content.ashx?file=,0,"harassment, discrimination, inclusion "
1207,What is Meaningful to Students When Considering a Company - Are There Preferences Based on Ethnicity and Gender?,"3,15,16,17",link,Student Papers,2019,04/23/2020,04/23/2020,,https://digitalcommons.ilr.cornell.edu/student/218,,,What is Meaningful to Students When Considering a Company - Are There Preferences Based on Ethnicity and Gender?,http://est05.esalestrack.com/eSalesTrack/Content/Content.ashx?file=,0,"Diversity &amp; Inclusion, Race/Ethnicity, gender"
1210,What Will Be the Future Diversity and Inclusion Trends with Regards to Gender?,"3,15,16,17",link,Student Papers,2019,04/23/2020,04/23/2020,,https://digitalcommons.ilr.cornell.edu/student/205,,,What Will Be the Future Diversity and Inclusion Trends with Regards to Gender?,http://est05.esalestrack.com/eSalesTrack/Content/Content.ashx?file=,0,"Diversity &amp; Inclusion, gender "
732,Building the Pipeline of Senior Women Leaders Working Group,"3,15,16,17",pdf,Working Group Summaries,2017,09/15/2017,10/07/2019,77532ab8-ec26-4cdb-a151-45b0d687e394.pdf,http://est05.esalestrack.com/eSalesTrack/Content/Content.ashx?file=77532ab8-ec26-4cdb-a151-45b0d687e394.pdf,Building the Pipeline of Senior Women Leaders Working Group notes,,Building the Pipeline of Senior Women Leaders Working Group notes,http://est05.esalestrack.com/eSalesTrack/Content/Content.ashx?file=,0,"senior leaders, women, pipeline, diversity, STEM, climate, high potential women, sponsorship, protege, advocacy, mentorship, mentor, mentee, coaching, inclusive, role models, leadership development, leadership management"
1535,Building Inclusive Cultures Virtual Working Group Notes,"3,15,16,17",pdf,Working Group Summaries,2021,04/26/2021,04/26/2021,a7636f47-968f-43d4-81c4-9c21476596fa.pdf,http://est05.esalestrack.com/eSalesTrack/Content/Content.ashx?file=a7636f47-968f-43d4-81c4-9c21476596fa.pdf,,,inclusive cultures ,http://est05.esalestrack.com/eSalesTrack/Content/Content.ashx?file=,0,"Diversity &amp; Inclusion, Diversity management, Diversity training, Equity Individual Differences, Aging/Gerontology, Race/Ethnicity, Justice perceptions, Gender Employees with Disabilities Generational Differences "
714,Diversity and Inclusion: Looking Forward,"3,15,16,17,19",pdf,Student Papers,2017,08/16/2017,10/07/2019,01451585-6074-4148-bb2b-31e3344a364f.pdf,https://est05.esalestrack.com/esalestrack/Content/Content.ashx?aid=2181&system_filename=01451585-6074-4148-bb2b-31e3344a364f.pdf,Diversity and Inclusion: Looking Forward student research,,Diversity and Inclusion: Looking Forward student research,http://est05.esalestrack.com/eSalesTrack/Content/Content.ashx?file=,0,"diversity, inclusion, diversity and inclusion, gender, race, advocates, D&amp;I, metrics, governance councils, governance"
860,Social Movements and HR: The Impact of #MeToo,"3,15,16,17,19",pdf,White Papers,2019,02/27/2019,10/03/2019,e239a11e-01f2-42a2-8f8f-e23c87a3ba59.pdf,https://est05.esalestrack.com/esalestrack/Content/Content.ashx?aid=2181&system_filename=e239a11e-01f2-42a2-8f8f-e23c87a3ba59.pdf,Social Movements and HR: The Impact of #MeToo White Paper,,Social Movements and HR: The Impact of #MeToo White Paper,http://est05.esalestrack.com/eSalesTrack/Content/Content.ashx?file=,0,"Organizational Climate, Organizational Culture,, Organizational Performance, Social Responsibility, Social Issues, Fairness &amp; Employment Law, Corporate Social Responsibility, Discrimination, Diversity, EEO, Equity, Employment Law, Ethics, Fairness, Harassment, Public,, Policy Issues, Privacy Issues, Social Issues &amp; HRM, Employee Voice/participation, interpersonal relationships, Affect/Emotions, Diversity, Gender/Sexual Orientation Values, Abusive Supervision Impression Management/Influence Tactics/Power/Politics Influence Tactics, Politics, Power, Discipline socialization, Emotional Labor, Stress, Well-being, Workplace bullying  "
592,Sponsorship of Women Leaders Working Group,"3,15,16,17,19",pdf,Working Group Summaries,2016,04/15/2016,10/15/2019,e630b724-8cb8-4f71-9854-07a393fb56e6.pdf,http://est05.esalestrack.com/eSalesTrack/Content/Content.ashx?file=e630b724-8cb8-4f71-9854-07a393fb56e6.pdf,Sponsorship of Women Leaders Working Group summary,,Sponsorship of Women Leaders Working Group summary,http://est05.esalestrack.com/eSalesTrack/Content/Content.ashx?file=,0,"sponsorship, mentorship, protege, unconscious bias, women leaders, leadership, leadership development, minority, high potential talent, global sponsorship, mentors, coaches, sponsors, identity transformation, talent, talent management, retention, millennials, generation Y, attracting talent, diversity, learning, globalization, generational differences, gender, training, learning "
750,Sponsorship of Women Working Group (Part 2),"3,15,16,17,19",pdf,Working Group Summaries,2017,11/08/2017,10/04/2019,59caa648-6278-4a9e-90ca-13c5a1bcc446.pdf,http://est05.esalestrack.com/eSalesTrack/Content/Content.ashx?file=59caa648-6278-4a9e-90ca-13c5a1bcc446.pdf,Sponsorship of Women Working Group (Part 2),,Sponsorship of Women Working Group (Part 2),http://est05.esalestrack.com/eSalesTrack/Content/Content.ashx?file=,0,"sponsorship, protege, high potential women, high potential minority, mentor, mentorship, women, people of color, advocacy, role incongruence, gender, culture, diversity, diversity &amp; inclusion, D&amp;I"
804,Diversity & Inclusion: Social Impact in the Workplace ,"3,15,16,17,19",pdf,Working Group Summaries,2018,11/13/2018,10/03/2019,100439ce-614b-4bec-bfe4-290a531813bf.pdf,https://est05.esalestrack.com/esalestrack/Content/Content.ashx?aid=2181&system_filename=100439ce-614b-4bec-bfe4-290a531813bf.pdf,Diversity & Inclusion: Social Impact in the Workplace working group summary,,Diversity & Inclusion: Social Impact in the Workplace working group summary,http://est05.esalestrack.com/eSalesTrack/Content/Content.ashx?file=,0,"politics, millennials, generation Z, engaged workforce, Coaching, Mentoring, Change Agents, Organizational Change, Organizational Climate, Organizational Culture, Organizational Development, Organizational Structure, Employee Surveys, Engagement, Involvement, Satisfaction, Customer Service, Employee Relations, Employee Voice/participation, Trust, Workplace Democracy, Employee Self-Service , HR Information Systems, HR Metrics, Abilities, Affect/Emotions, Aging/Gerontology, Diversity, Gender/Sexual Orientation, Generational Differences, Personality, Race/Ethnicity Values, Cross-cultural HR, Leadership Development, Managerial behavior, Politics, Social Responsibility, Sustainability, Salary Surveys, Total Rewards, Workplace bullying, Employee-organization Relationship/Psychological Contracts, Social Exchange, Social Networks, Virtual Teams, Affirmative Action, Comparable Worth, Disabilities, Discrimination, Diversity, EEO, Equity, Employment Law , Ethics, Fairness, Harassment, Public Policy Issues, Social Issues &amp; HRM"
735,A Multi-Level Process Model for Understanding Diversity Practice Effectiveness,"3,15,16,18",pdf,Research Links,2017,09/21/2017,10/07/2019,dbac575a-c302-44d5-a835-e732112d58db.pdf,http://est05.esalestrack.com/eSalesTrack/Content/Content.ashx?file=dbac575a-c302-44d5-a835-e732112d58db.pdf,A Multi-Level Process Model for Understanding Diversity Practice Effectiveness ResearchLink,,A Multi-Level Process Model for Understanding Diversity Practice Effectiveness ResearchLink,http://est05.esalestrack.com/eSalesTrack/Content/Content.ashx?file=,0,"diversity, inclusion, managers, employees with disabilities, management, leadership, leadership development, culture"
719,Inclusion of People With Disabilities in the Workplace,"3,15,16,18",pdf,Student Papers,2017,08/16/2017,10/07/2019,49761c12-1ce2-4fc0-831e-18ed27658a57.pdf,https://est05.esalestrack.com/esalestrack/Content/Content.ashx?aid=2181&system_filename=49761c12-1ce2-4fc0-831e-18ed27658a57.pdf,Inclusion of People With Disabilities in the Workplace student research,,Inclusion of People With Disabilities in the Workplace student research,http://est05.esalestrack.com/eSalesTrack/Content/Content.ashx?file=,0,"diversity, inclusion, diversity and inclusion, D&amp;I, disabilities, climate, culture, disabled, ADA, Americans with Disabilities, disclosure, wheelchair, blind, deaf, hidden disabilities disability disclosure, stereotypes, accommodations, universal design, employees with disabilities"
1840,What can Organizations do to Create an Environment that Supports and Retains Neurodiverse Employees?,"3,15,16,18",link,Student Papers,2023,01/25/2023,01/26/2023,,https://ecommons.cornell.edu/handle/1813/112759,,,,http://est05.esalestrack.com/eSalesTrack/Content/Content.ashx?file=,0,"discrimination, equity, individual differences, justice perceptions, employees with disabilities, diversity management, diversity training"
1386,CAHRS Quarterly on Diversity and Inclusion - Fall 2020,"3,15,16,46",pdf,News,2020,10/13/2020,10/13/2020,9fce2ab8-d2bb-42d0-a276-57a55bb32fb9.pdf,http://est05.esalestrack.com/eSalesTrack/Content/Content.ashx?file=9fce2ab8-d2bb-42d0-a276-57a55bb32fb9.pdf,,7471b829-2b55-45bb-b4ad-aa7c9b457e5f.jpg,black and white people shaking hands,http://est05.esalestrack.com/eSalesTrack/Content/Content.ashx?file=7471b829-2b55-45bb-b4ad-aa7c9b457e5f.jpg,2020,
909,What Are Companies Doing to Retain as Well as Develop People of Color and Women?,"3,15,17",link,Student Papers,2017,04/24/2019,10/02/2019,,https://digitalcommons.ilr.cornell.edu/student/166/,student reserach answers the question What Are Companies Doing to Retain as Well as Develop People of Color and Women?,,student reserach answers the question What Are Companies Doing to Retain as Well as Develop People of Color and Women?,http://est05.esalestrack.com/eSalesTrack/Content/Content.ashx?file=,0,"retention, retain, development, learning, people of color, PoC, women, gender, diversity, inclusion, Diversity, Gender/Sexual Orientation, Individual Differences, Race/Ethnicity "
955,What is the Definition of Gender Pay Equity?,"3,15,17",link,Student Papers,2016,05/06/2019,09/30/2019,,https://digitalcommons.ilr.cornell.edu/student/132/,student research answers the question What is the Definition of Gender Pay Equity?,,student research answers the question What is the Definition of Gender Pay Equity?,http://est05.esalestrack.com/eSalesTrack/Content/Content.ashx?file=,0,"Pay Structures, Diversity, Gender/Sexual Orientation, equity, fairness "
959,What Are Organizational and Cultural Barriers in the Workplace to Woman Advancing to the C-Suite?,"3,15,17",link,Student Papers,2016,05/06/2019,09/30/2019,,https://digitalcommons.ilr.cornell.edu/student/126/,student research answers the question What Are Organizational and Cultural Barriers in the Workplace to Woman Advancing to the C-Suite?,,student research answers the question What Are Organizational and Cultural Barriers in the Workplace to Woman Advancing to the C-Suite?,http://est05.esalestrack.com/eSalesTrack/Content/Content.ashx?file=,0,"Diversity, Gender/Sexual Orientation, Leader Emergence, Leadership Development, Leadership Theory, Impression Management/Influence Tactics/Power/Politics, Politics, power "
974,What Are the Top Factors That Prevent Women and Racial/Ethnic Minority Employees From Leaving Engineering Professions or the Tech Industry?,"3,15,17",link,Student Papers,2016,05/07/2019,09/30/2019,,https://digitalcommons.ilr.cornell.edu/student/104/,student research answers the question What Are the Top Factors That Prevent Women and Racial/Ethnic Minority Employees From Leaving Engineering Professions or the Tech Industry?,,student research answers the question What Are the Top Factors That Prevent Women and Racial/Ethnic Minority Employees From Leaving Engineering Professions or the Tech Industry?,http://est05.esalestrack.com/eSalesTrack/Content/Content.ashx?file=,0,"Technology, Robotics, Diversity, Gender/Sexual Orientation "
842,#MeToo Policy,"3,15,17",video,Videos,2018,01/17/2019,10/03/2019,,https://www.youtube.com/watch?v=zsdugs9yCLA&list=PLdvxLwoHBNn9s9l-VFBRBvU5j_kP4kw1k&index=3&t=0s,#MeToo Policy video clip,,#MeToo Policy video clip,http://est05.esalestrack.com/eSalesTrack/Content/Content.ashx?file=,0,"diversity, sexual harassment, whistleblowing, ethics, workplace privacy, employment law, affirmative action, discrimination/adverse impact "
843,#MeToo Leadership,"3,15,17",video,Videos,2018,01/17/2019,10/03/2019,,https://www.youtube.com/watch?v=TtDTRAurnP0&index=3&list=PLdvxLwoHBNn9s9l-VFBRBvU5j_kP4kw1k,#MeToo Leadership video clip,8e72d10a-beda-4861-b058-1a8131232b46.jpg,#MeToo Leadership video clip,http://est05.esalestrack.com/eSalesTrack/Content/Content.ashx?file=8e72d10a-beda-4861-b058-1a8131232b46.jpg,0,"diversity, sexual harassment, whistleblowing, ethics, workplace privacy, employment law, affirmative action, discrimination/adverse impact "
845,#MeToo Summary of Innovative Practices,"3,15,17",video,Videos,2018,01/17/2019,10/03/2019,,https://www.youtube.com/watch?v=EeiVDOTVrJg&list=PLdvxLwoHBNn9s9l-VFBRBvU5j_kP4kw1k&index=6,#MeToo Summary of Innovative Practices video clip,,#MeToo Summary of Innovative Practices video clip,http://est05.esalestrack.com/eSalesTrack/Content/Content.ashx?file=,0,"diversity, sexual harassment, whistleblowing, ethics, workplace privacy, employment law, affirmative action, discrimination/adverse impact "
936,Is There a Correlation Between Diversity in the Workforce and Diversity in the Leadership and Business Results?,"3,15,17,19",link,Student Papers,2016,05/01/2019,10/02/2019,,https://digitalcommons.ilr.cornell.edu/student/119/,students answer the research question Is There a Correlation Between Diversity in the Workforce and Diversity in the Leadership and Business Results?,,students answer the research question Is There a Correlation Between Diversity in the Workforce and Diversity in the Leadership and Business Results?,http://est05.esalestrack.com/eSalesTrack/Content/Content.ashx?file=,0,"Entrepreneurship, Departments and Function, Aging/Gerontology, Diversity, Gender/Sexual Orientation, Generational Differences, Individual Differences "
940,Can we Reduce Bias in the Recruiting Process and Diversify Pools of Candidates by Using Different Types of Words in Job Descriptions?,"3,15,17,19",link,Student Papers,2016,05/01/2019,10/02/2019,,https://digitalcommons.ilr.cornell.edu/student/140/,students answer the question Can we Reduce Bias in the Recruiting Process and Diversify Pools of Candidates by Using Different Types of Words in Job Descriptions?,,students answer the question Can we Reduce Bias in the Recruiting Process and Diversify Pools of Candidates by Using Different Types of Words in Job Descriptions?,http://est05.esalestrack.com/eSalesTrack/Content/Content.ashx?file=,0,"Diversity, Gender/Sexual Orientation, Generational Differences, Individual Differences, Recruitment "
841,#MeToo Training,"3,15,17,46",video,Videos,2018,01/17/2019,10/03/2019,,https://www.youtube.com/watch?v=Xs8U-MZLWEw&list=PLdvxLwoHBNn9s9l-VFBRBvU5j_kP4kw1k&index=2&t=0s,#MeToo Training video clip,c4d3a037-8519-4a61-9eb0-1563a40c7390.jpg,#MeToo Training video clip,http://est05.esalestrack.com/eSalesTrack/Content/Content.ashx?file=c4d3a037-8519-4a61-9eb0-1563a40c7390.jpg,0,"diversity, sexual harassment, whistleblowing, ethics, workplace privacy, employment law, affirmative action, discrimination/adverse impact "
957,How do we Bridge the Gap Between the Five Generations in the Workforce and Reduce Biases Around Age?,"3,15,19",link,Student Papers,2016,05/06/2019,09/30/2019,,https://digitalcommons.ilr.cornell.edu/student/120/,student research answers the questionHow do we Bridge the Gap Between the Five Generations in the Workforce and Reduce Biases Around Age?,,student research answers the questionHow do we Bridge the Gap Between the Five Generations in the Workforce and Reduce Biases Around Age?,http://est05.esalestrack.com/eSalesTrack/Content/Content.ashx?file=,0,"Aging/Gerontology, Diversity "
1147,Synergy From Diversity: Managing the Performance Benefits of Team Diversity ResearchBrief ,"3,15,46",pdf,Research Links,2020,02/27/2020,02/27/2020,42f28f2b-fc5d-4a2a-b743-dd9944140a61.pdf,http://est05.esalestrack.com/eSalesTrack/Content/Content.ashx?file=42f28f2b-fc5d-4a2a-b743-dd9944140a61.pdf,,,Diversity ResearchBrief ,http://est05.esalestrack.com/eSalesTrack/Content/Content.ashx?file=,0,"Diversity, Gender/Sexual Orientation, Generational Differences, Individual differences, Personality, Race/Ethnicity, Values, Communication, Employee-organization, Relationship/Psychological Contracts, Social Exchange, Social Networks, Team Composition, Team Development, Team Dynamics  "
924,What Indicators Exist That Lead to Employees Feeling Included?,"3,15,46",link,Student Papers,2017,04/25/2019,10/02/2019,,https://digitalcommons.ilr.cornell.edu/student/169/,student reserach answering the question What Indicators Exist That Lead to Employees Feeling Included?,,student reserach answering the question What Indicators Exist That Lead to Employees Feeling Included?,http://est05.esalestrack.com/eSalesTrack/Content/Content.ashx?file=,0,"inclusion, indicators, diversity, diversity and inclusion, Affect/Emotions/Mood, Commitment, Employee Attitudes, Engagement, Involvement, Satisfaction "
960,How Are Ethnic Hairstyles Really Viewed in the Workplace?,"3,15,46",link,Student Papers,2016,05/06/2019,09/30/2019,,https://digitalcommons.ilr.cornell.edu/student/139/,student research answers the question How Are Ethnic Hairstyles Really Viewed in the Workplace?,,student research answers the question How Are Ethnic Hairstyles Really Viewed in the Workplace?,http://est05.esalestrack.com/eSalesTrack/Content/Content.ashx?file=,0,"Discrimination, Diversity, EEO, Equity, Fairness, Justice perceptions "
1843,What Practices do Global Organizations in the US do to Ensure Global Inclusion?,"3,16",link,Student Papers,2023,01/25/2023,01/26/2023,,https://ecommons.cornell.edu/handle/1813/112757,,,,http://est05.esalestrack.com/eSalesTrack/Content/Content.ashx?file=,0,diversity &amp; inclusion
1671,Does Gen Z Value Different Things at Work than Prior Generations and What Total Rewards Attract Them?,"3,16,19",link,Student Papers,2022,02/16/2022,02/16/2022,,https://ecommons.cornell.edu/handle/1813/110976,,,,http://est05.esalestrack.com/eSalesTrack/Content/Content.ashx?file=,0,"generational differences, inclusion"
970,Are There Differences in Long-Term Commitment Between the Different Generations in the Workforce?,"3,19",link,Student Papers,2016,05/07/2019,09/30/2019,,https://digitalcommons.ilr.cornell.edu/student/113/,student research answers the question Are There Differences in Long-Term Commitment Between the Different Generations in the Workforce?,,student research answers the question Are There Differences in Long-Term Commitment Between the Different Generations in the Workforce?,http://est05.esalestrack.com/eSalesTrack/Content/Content.ashx?file=,0,"Generational Differences, Succession Planning, Workforce Trends, Aging/Gerontology "
1695,Targeted Benchmarking on Differentiated Programs and Development Practices,"3,19,37,40,46",pdf,Benchmarking,2021,02/23/2022,02/23/2022,b4bef57b-ce24-4781-8b9b-c5a408a07e13.pdf,https://est05.esalestrack.com/esalestrack/Content/Content.ashx?aid=2181&system_filename=b4bef57b-ce24-4781-8b9b-c5a408a07e13.pdf,,,Targeted Benchmarking on Differentiated Programs and Development Practices,http://est05.esalestrack.com/eSalesTrack/Content/Content.ashx?file=,0,"Differentiated Programs, Development Practices, Underrepresented talent"
1621,Targeted Benchmarking on Global DE&I Representative Metrics,"3,23,28,46",pdf,Benchmarking,2021,12/07/2021,12/07/2021,dd1d2abf-1e97-42cf-a3e0-885ab4ba9bd4.pdf,https://est05.esalestrack.com/eSalesTrack/Content/Content.ashx?aid=2181&system_filename=dd1d2abf-1e97-42cf-a3e0-885ab4ba9bd4.pdf,,,Targeted Benchmarking on Global DE&I Representative Metrics,http://est05.esalestrack.com/eSalesTrack/Content/Content.ashx?file=,0,"Global, DE&amp;I, Representative, Metrics"
1829,Targeted Benchmarking on What are the Voluntary Self-Identification  Categories Companies Offer to their Employees?,"3,37,46,47",pdf,Benchmarking,2022,01/06/2023,01/06/2023,ef9ee48d-4a97-4f9a-864e-9245e3530e93.pdf,https://est05.esalestrack.com/eSalesTrack/Content/Content.ashx?aid=2181&system_filename=ef9ee48d-4a97-4f9a-864e-9245e3530e93.pdf,,,,http://est05.esalestrack.com/eSalesTrack/Content/Content.ashx?file=,0,"Self Identifiers, Voluntary, Race"
1759,Targeted Benchmarking on Disability Accommodations,"3,46",pdf,Benchmarking,2022,06/28/2022,06/28/2022,d8e61c3a-1584-440f-9e34-1e157998ef2b.pdf,https://est05.esalestrack.com/eSalesTrack/Content/Content.ashx?aid=2181&system_filename=d8e61c3a-1584-440f-9e34-1e157998ef2b.pdf,Targeted Benchmarking on Disability Accommodations,,Targeted Benchmarking on Disability Accommodations,http://est05.esalestrack.com/eSalesTrack/Content/Content.ashx?file=,0,"Disability, accommodations"
1393,Building Culture and Community in a COVID-Era Workplace,"3,46,50",pdf,Working Group Summaries,2020,10/13/2020,10/13/2020,a011d4c2-82f7-40a3-ac81-0b255041a0fd.pdf,http://est05.esalestrack.com/eSalesTrack/Content/Content.ashx?file=a011d4c2-82f7-40a3-ac81-0b255041a0fd.pdf,,,,http://est05.esalestrack.com/eSalesTrack/Content/Content.ashx?file=,0,"HR Strategy, Climate, Culture, &amp; Change , Change Agents, Organizational Change, Organizational Climate, Organizational Culture, Diversity &amp; Inclusion "
1441,DE&I as a Key Theme Given Racial and Social Injustrices in 2020,"3,47",video,Videos,2021,02/15/2021,03/11/2021,,https://www.youtube.com/watch?v=yWLYpsn4IRc&list=PLdvxLwoHBNn9s9l-VFBRBvU5j_kP4kw1k&index=3,,1253e4bc-5b8c-4af4-9b07-532dc078a8ab.jpg,DE&I as a Key Theme Given Racial and Social Injustrices in 2020,http://est05.esalestrack.com/eSalesTrack/Content/Content.ashx?file=1253e4bc-5b8c-4af4-9b07-532dc078a8ab.jpg,0,"Diversity &amp; Inclusion , Discrimination, Diversity management, Diversity training, EEO, Equity "
1839, What do HR Professionals need to know to Support Employee Well-Being in a Post-COVID World? ? ,"4,10,11,14",link,Student Papers,2023,01/25/2023,01/26/2023,,https://ecommons.cornell.edu/handle/1813/112760,,,,http://est05.esalestrack.com/eSalesTrack/Content/Content.ashx?file=,0,"benefits, incentives, work/life &amp; wellbeing, well-being, wellness, work-life balance"
