resource_id,title,topic_ids,resource_format,resource_type,year,date_added,date_updated,pdf_upload,pdf_html_url,summary,thumbnail,thumbnail_alt_tag,thumbnail_url,issue_year,keywords
1040,HR for HR in Times of Transformation,"8,24,33,37,44",link,Videos,2019,09/18/2019,12/20/2019,,http://www.cornell.edu/video/hr-for-hr-times-of-transformation,webinar about HR for HR in times of transformation,db223a75-da8b-42b5-8e74-db5c5d5221ad.jpg,HR Transformation,http://est05.esalestrack.com/eSalesTrack/Content/Content.ashx?file=db223a75-da8b-42b5-8e74-db5c5d5221ad.jpg,0,"HR Transformation, HR for HR, HRBP, talent development, data "
1141,Applying the HR Experience Map to Your Business Model ,"8,24,33,37,50",video,Videos,2020,02/14/2020,10/08/2020,,https://www.youtube.com/watch?v=Xunh5xBKee4&list=PLdvxLwoHBNn9s9l-VFBRBvU5j_kP4kw1k&index=2,,3dc64ef3-947b-42da-82f7-b833e4dd6cfa.jpg,hands in a circle coming together,http://est05.esalestrack.com/eSalesTrack/Content/Content.ashx?file=3dc64ef3-947b-42da-82f7-b833e4dd6cfa.jpg,0,"Career management, Careers/Occupational Choice/Job Search (e.g., Career Success, Career Management, Career Development), Career Paths, Career Success, Coaching, Mentoring, Change Agents, Organizational Change Organizational Climate, Organizational Culture, Organizational Development, Organizational Structure, Executive Development, Knowledge management, Learning, Management Development, Trainability, Training Design, Training Evaluation, Training Methods, Transfer of Training"
876,What Are Some Effective and Innovative Approaches to Succession Planning?,"8,24,34,37",link,Student Papers,2018,04/15/2019,10/03/2019,,https://digitalcommons.ilr.cornell.edu/student/192/,student research answers the question What Are Some Effective and Innovative Approaches to Succession Planning?,,student research answers the question What Are Some Effective and Innovative Approaches to Succession Planning?,http://est05.esalestrack.com/eSalesTrack/Content/Content.ashx?file=,0,"innovation, succession planning, Sourcing, Succession, Planning, Workforce Trends, Generational Differences "
690,Recommendations For How HR Leaders Can be Innovation Change Agents,"8,24,34,37,47,50,51",pdf,Student Papers,2017,05/22/2017,10/07/2019,643dac25-ae2f-4e80-9bf2-c85bb72f22ae.pdf,http://est05.esalestrack.com/eSalesTrack/Content/Content.ashx?file=643dac25-ae2f-4e80-9bf2-c85bb72f22ae.pdf,Recommendations For How HR Leaders Can be Innovation Change Agents ResearchBrief,,Recommendations For How HR Leaders Can be Innovation Change Agents ResearchBrief,http://est05.esalestrack.com/eSalesTrack/Content/Content.ashx?file=,0,"innovation, HR, change agent, communication, information sharing, culture, market, agility, talent, post-mortem process, talent gaps, leadership, customer, diversity, partnerships, innovation groups, expertise, risk taking, collaboration, talent management, performance management, strategy, crowdsourcing, design thinking"
969,What is the Impact of Blended learning Including Micro-Learning on Manager Learning and Behavior Change vs. Impact of Classroom Learning?,"8,24,35,37,41,42",link,Student Papers,2016,05/07/2019,09/30/2019,,https://digitalcommons.ilr.cornell.edu/student/100/,student research answers the question What is the Impact of Blended learning Including Micro-Learning on Manager Learning and Behavior Change vs. Impact of Classroom Learning?,,student research answers the question What is the Impact of Blended learning Including Micro-Learning on Manager Learning and Behavior Change vs. Impact of Classroom Learning?,http://est05.esalestrack.com/eSalesTrack/Content/Content.ashx?file=,0,"Knowledge management, Learning, Management Development, Onboarding,Trainability, Training Design, Training Methods, Transfer of Training "
1124,HR Development in Later Career,"8,24,35,37,41,42,50",video,Videos,2020,02/14/2020,02/14/2020,,https://www.youtube.com/watch?v=H0Bp0PqpZSg&list=PLdvxLwoHBNn9s9l-VFBRBvU5j_kP4kw1k&index=10,,dd5f680c-3f88-4056-9702-801adbc10e6f.jpg,stack of books representing HR development ,http://est05.esalestrack.com/eSalesTrack/Content/Content.ashx?file=dd5f680c-3f88-4056-9702-801adbc10e6f.jpg,0,"Career management, Careers/Occupational Choice/Job Search (e.g., Career Success, Career Management, Career Development), Career Paths, Career Success, Coaching, Mentoring, Change Agents, Organizational Change Organizational Climate, Organizational Culture, Organizational Development, Organizational Structure, Executive Development, Knowledge management, Learning, Management Development, Trainability, Training Design, Training Evaluation, Training Methods, Transfer of Training"
976,Would Opening a Satellite Office in or Near a Major Metropolitan City be Beneficial in the Successful Recruitment and Retention of High Potential Young Employees?,"8,24,37",link,Student Papers,2016,05/07/2019,09/30/2019,,https://digitalcommons.ilr.cornell.edu/student/98/,student research answers the question Would Opening a Satellite Office in or Near a Major Metropolitan City be Beneficial in the Successful Recruitment and Retention of High Potential Young Employees?,,student research answers the question Would Opening a Satellite Office in or Near a Major Metropolitan City be Beneficial in the Successful Recruitment and Retention of High Potential Young Employees?,http://est05.esalestrack.com/eSalesTrack/Content/Content.ashx?file=,0,"Recruitment, Sourcing, Workforce Trends, Retention, Turnover "
1097,HR & Organizational Politics ,"8,24,37",video,Videos,2019,01/29/2020,01/29/2020,,https://youtu.be/xgOjSfjTIeM ,HR & Organizational Politics ,ed059793-d587-4974-9d9c-ebb7867782d7.jpg,HR & Organizational Politics ,http://est05.esalestrack.com/eSalesTrack/Content/Content.ashx?file=ed059793-d587-4974-9d9c-ebb7867782d7.jpg,0,"organizational politics, talent, talent management"
898,How Can Organizations Best Identify and Develop Talent For General Management (GM) Roles?,"8,24,37,38",link,Student Papers,2017,04/23/2019,10/02/2019,,https://digitalcommons.ilr.cornell.edu/student/159/,student research answers the question How Can Organizations Best Identify and Develop Talent For General Management (GM) Roles?,,student research answers the question How Can Organizations Best Identify and Develop Talent For General Management (GM) Roles?,http://est05.esalestrack.com/eSalesTrack/Content/Content.ashx?file=,0,"general manager, talent, talent management, develop talent, Leader Emergence, Leadership Development, Leadership Theory, Managerial behavior "
848,Growing Focus on Early Career Talent,"8,24,37,38,40",video,Videos,2018,01/17/2019,10/03/2019,,https://www.youtube.com/watch?v=okfOUE22VUw&index=10&list=PLdvxLwoHBNn9s9l-VFBRBvU5j_kP4kw1k,Growing Focus on Early Career Talent video clip,,Growing Focus on Early Career Talent video clip,http://est05.esalestrack.com/eSalesTrack/Content/Content.ashx?file=,0,"Career Coaching/Mentoring, Career Development, Career Management, Career Paths, Career Success/Failure, Executive Development, Needs Assessment, Distance Learning, Needs Assessment, Training: Design and Methods, Training Evaluation, Transfer of Training, future of work"
850,Foundations of Early Career Talent Strategy,"8,24,37,38,40",video,Videos,2018,01/17/2019,10/03/2019,,https://www.youtube.com/watch?v=mRlBtosvy60&list=PLdvxLwoHBNn9s9l-VFBRBvU5j_kP4kw1k&index=8,Foundations of Early Career Talent Strategy video clip,,Foundations of Early Career Talent Strategy video clip,http://est05.esalestrack.com/eSalesTrack/Content/Content.ashx?file=,0,"Career Coaching/Mentoring, Career Development, Career Management, Career Paths, Career Success/Failure, Executive Development, Needs Assessment, Distance Learning, Needs Assessment, Training: Design and Methods, Training Evaluation, Transfer of Training, future of work, rotational programs"
851,Early Career Development Webcast,"8,24,37,38,40",link,Videos,2018,01/17/2019,10/03/2019,,https://www.cornell.edu/video/early-career-development-webcast-september-2018,Early Career Development Webcast,,Early Career Development Webcast,http://est05.esalestrack.com/eSalesTrack/Content/Content.ashx?file=,0,"Career Coaching/Mentoring, Career Development, Career Management, Career Paths, Career Success/Failure, Executive Development, Needs Assessment, Distance Learning, Needs Assessment, Training: Design and Methods, Training Evaluation, Transfer of Training, future of work, rotational programs"
1132,The Future of Skill Development,"8,24,37,38,41",video,Videos,2020,02/14/2020,02/14/2020,,https://www.youtube.com/watch?v=QGEtTR3Vaq4&list=PLdvxLwoHBNn9s9l-VFBRBvU5j_kP4kw1k&index=6,,5a097edc-60b3-493a-b879-348c38d00cb1.jpg,spiderman reading a book representing developing skills,http://est05.esalestrack.com/eSalesTrack/Content/Content.ashx?file=5a097edc-60b3-493a-b879-348c38d00cb1.jpg,0,"Career management, Careers/Occupational Choice/Job Search (e.g., Career Success, Career Management, Career Development), Career Paths, Career Success, Coaching, Mentoring, Change Agents, Organizational Change Organizational Climate, Organizational Culture, Organizational Development, Organizational Structure, Executive Development, Knowledge management, Learning, Management Development, Trainability, Training Design, Training Evaluation, Training Methods, Transfer of Training"
1104,HR Career Development in the Face of HR Transformation,"8,24,37,38,41,42",pdf,White Papers,2020,02/04/2020,02/04/2020,0278fe6f-45ea-439b-8b17-9d066488d2e9.pdf,http://est05.esalestrack.com/eSalesTrack/Content/Content.ashx?file=0278fe6f-45ea-439b-8b17-9d066488d2e9.pdf,,,HR transformation,http://est05.esalestrack.com/eSalesTrack/Content/Content.ashx?file=,0,"Career management, Careers/Occupational Choice/Job Search (e.g., Career Success, Career Management, Career Development), Career Paths, Career Success, Coaching, Mentoring, Change Agents, Organizational Change Organizational Climate, Organizational Culture, Organizational Development, Organizational Structure, Executive Development, Knowledge management, Learning, Management Development, Trainability, Training Design, Training Evaluation, Training Methods, Transfer of Training  "
1112,Types of Development Offered by CAHRS Partners,"8,24,37,38,41,50",video,Videos,2020,02/14/2020,02/14/2020,,https://www.youtube.com/watch?v=pDGXoro6hu8&list=PLdvxLwoHBNn9s9l-VFBRBvU5j_kP4kw1k&index=16,,ff705d65-5218-4091-804d-070e30c72ec3.jpg,shed with the phrase always room to grow painted on it ,http://est05.esalestrack.com/eSalesTrack/Content/Content.ashx?file=ff705d65-5218-4091-804d-070e30c72ec3.jpg,0,"Career management, Careers/Occupational Choice/Job Search (e.g., Career Success, Career Management, Career Development), Career Paths, Career Success, Coaching, Mentoring, Change Agents, Organizational Change Organizational Climate, Organizational Culture, Organizational Development, Organizational Structure, Executive Development, Knowledge management, Learning, Management Development, Trainability, Training Design, Training Evaluation, Training Methods, Transfer of Training"
1120,Foundational Roles for the HRBP,"8,24,37,38,41,50",video,Videos,2020,02/14/2020,02/14/2020,,https://www.youtube.com/watch?v=PdT4y4nTMZI&list=PLdvxLwoHBNn9s9l-VFBRBvU5j_kP4kw1k&index=12,,8e8ecabd-1d21-4345-ba7b-4b8a31353b9a.jpg,architectural building representing foundation,http://est05.esalestrack.com/eSalesTrack/Content/Content.ashx?file=8e8ecabd-1d21-4345-ba7b-4b8a31353b9a.jpg,0,"Career management, Careers/Occupational Choice/Job Search (e.g., Career Success, Career Management, Career Development), Career Paths, Career Success, Coaching, Mentoring, Change Agents, Organizational Change Organizational Climate, Organizational Culture, Organizational Development, Organizational Structure, Executive Development, Knowledge management, Learning, Management Development, Trainability, Training Design, Training Evaluation, Training Methods, Transfer of Training"
1130,Key Takeaways on HR Career Development,"8,24,37,38,41,51",video,Videos,2020,02/14/2020,02/14/2020,,https://www.youtube.com/watch?v=xjn8IzMrvLA&list=PLdvxLwoHBNn9s9l-VFBRBvU5j_kP4kw1k&index=7,,9ed5da22-f018-4611-9707-a2aea47c7293.jpg,laptop open with globe on it representing learning,http://est05.esalestrack.com/eSalesTrack/Content/Content.ashx?file=9ed5da22-f018-4611-9707-a2aea47c7293.jpg,0,"Career management, Careers/Occupational Choice/Job Search (e.g., Career Success, Career Management, Career Development), Career Paths, Career Success, Coaching, Mentoring, Change Agents, Organizational Change Organizational Climate, Organizational Culture, Organizational Development, Organizational Structure, Executive Development, Knowledge management, Learning, Management Development, Trainability, Training Design, Training Evaluation, Training Methods, Transfer of Training"
877,What Are the Predictors of a Successful People Manager? ,"8,24,37,38,51",link,Student Papers,2018,04/15/2019,10/03/2019,,https://digitalcommons.ilr.cornell.edu/student/187/,student reserach answers the question What Are the Predictors of a Successful People Manager? ,,student reserach answers the question What Are the Predictors of a Successful People Manager? ,http://est05.esalestrack.com/eSalesTrack/Content/Content.ashx?file=,0,"successful manager, people manager, predictors, Influence, Tactics, Leader Emergence, Leadership Development, Leadership Theory, Managerial behavior, Motivation , Performance Assessment, Performance Management "
1134,Development Trends for More Senior HR Leaders ,"8,24,37,38,51",video,Videos,2020,02/14/2020,02/14/2020,,https://www.youtube.com/watch?v=6X2lkIpPMQU&list=PLdvxLwoHBNn9s9l-VFBRBvU5j_kP4kw1k&index=5,,343b6a07-7116-4f82-9619-fca79a58c48b.jpg,word cloud with leadership highlighted,http://est05.esalestrack.com/eSalesTrack/Content/Content.ashx?file=343b6a07-7116-4f82-9619-fca79a58c48b.jpg,0,"Career management, Careers/Occupational Choice/Job Search (e.g., Career Success, Career Management, Career Development), Career Paths, Career Success, Coaching, Mentoring, Change Agents, Organizational Change Organizational Climate, Organizational Culture, Organizational Development, Organizational Structure, Executive Development, Knowledge management, Learning, Management Development, Trainability, Training Design, Training Evaluation, Training Methods, Transfer of Training"
769,Early Career Development ,"8,24,37,38,51",pdf,Working Group Summaries,2018,04/02/2018,10/04/2019,5bb7dfde-bec8-4a7e-81ed-f2e30cb6d25c.pdf,https://est05.esalestrack.com/esalestrack/Content/Content.ashx?aid=2181&system_filename=5bb7dfde-bec8-4a7e-81ed-f2e30cb6d25c.pdf,Early Career Development working group summary,,Early Career Development working group summary,http://est05.esalestrack.com/eSalesTrack/Content/Content.ashx?file=,0,"early career development, high-performer, HIPO, cross functional training, employee performance, career development, talent pipeline, rotations, rotational program, employee resource groups, ERGs, leadership pipeline, leadership development, globalization"
1035,When do Losers Become Leavers? Rejection and Turnover in Internal Talent Markets ResearchBrief,"8,24,37,40",pdf,Research Links,2019,08/21/2019,09/26/2019,60f3f53c-6330-41e6-8d5f-ebc96a06e23b.pdf,http://est05.esalestrack.com/eSalesTrack/Content/Content.ashx?file=60f3f53c-6330-41e6-8d5f-ebc96a06e23b.pdf,ResearchBrief about rejection and turnover in internal talent markets,,,http://est05.esalestrack.com/eSalesTrack/Content/Content.ashx?file=,0,"internal candidate, external candidate, candidate selection, talent acquisition, talent management"
910,How Are Pre-Hire Assessments Contributing to Unbiased and More Targeted Successful Hires?,"8,24,37,40",link,Student Papers,2017,04/24/2019,10/02/2019,,https://digitalcommons.ilr.cornell.edu/student/149/,student research answers the question How Are Pre-Hire Assessments Contributing to Unbiased and More Targeted Successful Hires?,,student research answers the question How Are Pre-Hire Assessments Contributing to Unbiased and More Targeted Successful Hires?,http://est05.esalestrack.com/eSalesTrack/Content/Content.ashx?file=,0,"pre-hire assessments, assessments, successful hires, attracting talent"
712,Employer Branding and Attracting Talent Summary,"8,24,37,40,47",pdf,Working Group Summaries,2017,07/14/2017,10/07/2019,270afc2f-56e2-4c2c-bf5a-f08b255e086a.pdf,http://est05.esalestrack.com/eSalesTrack/Content/Content.ashx?file=270afc2f-56e2-4c2c-bf5a-f08b255e086a.pdf,Employer Branding and Attracting Talent working group  Summary,,Employer Branding and Attracting Talent working group  Summary,http://est05.esalestrack.com/eSalesTrack/Content/Content.ashx?file=,0,"employer branding, branding, attracting talent, talent, talent management, millennials, employe value proposition, employer brand, engagement, culture"
874,What Are the Best Practices to Conduct Sales Training?,"8,24,37,41,42",link,Student Papers,2018,04/15/2019,10/03/2019,,https://digitalcommons.ilr.cornell.edu/student/188/,What Are the Best Practices to Conduct Sales Training?,,What Are the Best Practices to Conduct Sales Training?,http://est05.esalestrack.com/eSalesTrack/Content/Content.ashx?file=,0,"sales training, training, training and development, Basic Skills Training, Executive Development, Knowledge management, Learning, Management Development, Needs Assessment, Onboarding, Socialization , Trainability, Training Design,, Training Evaluation, Training Methods, Transfer of Training "
1136,How Has HR Transformation Influenced Early Career Roles?,"8,24,37,41,42",video,Videos,2020,02/14/2020,02/14/2020,,https://www.youtube.com/watch?v=5fdagvPJC04&list=PLdvxLwoHBNn9s9l-VFBRBvU5j_kP4kw1k&index=4,,baae4975-1321-4aed-91b5-ef99a0b4fb01.jpg,two open computers representing executives ,http://est05.esalestrack.com/eSalesTrack/Content/Content.ashx?file=baae4975-1321-4aed-91b5-ef99a0b4fb01.jpg,0,"Career management, Careers/Occupational Choice/Job Search (e.g., Career Success, Career Management, Career Development), Career Paths, Career Success, Coaching, Mentoring, Change Agents, Organizational Change Organizational Climate, Organizational Culture, Organizational Development, Organizational Structure, Executive Development, Knowledge management, Learning, Management Development, Trainability, Training Design, Training Evaluation, Training Methods, Transfer of Training"
1138,Top Skill Sets in an Effective HRBP,"8,24,37,41,44",video,Videos,2020,02/14/2020,02/14/2020,,https://www.youtube.com/watch?v=RrxNGcd4kCA&list=PLdvxLwoHBNn9s9l-VFBRBvU5j_kP4kw1k&index=3,,3600f4a5-a441-4087-9079-0cfa098a5335.jpg,people around a table with laptops representing a meeting,http://est05.esalestrack.com/eSalesTrack/Content/Content.ashx?file=3600f4a5-a441-4087-9079-0cfa098a5335.jpg,0,"Career management, Careers/Occupational Choice/Job Search (e.g., Career Success, Career Management, Career Development), Career Paths, Career Success, Coaching, Mentoring, Change Agents, Organizational Change Organizational Climate, Organizational Culture, Organizational Development, Organizational Structure, Executive Development, Knowledge management, Learning, Management Development, Trainability, Training Design, Training Evaluation, Training Methods, Transfer of Training"
1110,HR Skill Areas of Focus ,"8,24,37,41,50",video,Videos,2020,02/14/2020,02/14/2020,,https://www.youtube.com/watch?v=7-XcSsDfDR4&list=PLdvxLwoHBNn9s9l-VFBRBvU5j_kP4kw1k&index=17,,5a91b021-157b-4787-ad2c-f8899f7efdb8.jpg,image of toy made for user to think about next steps ,http://est05.esalestrack.com/eSalesTrack/Content/Content.ashx?file=5a91b021-157b-4787-ad2c-f8899f7efdb8.jpg,0,"Career management, Careers/Occupational Choice/Job Search (e.g., Career Success, Career Management, Career Development), Career Paths, Career Success, Coaching, Mentoring, Change Agents, Organizational Change Organizational Climate, Organizational Culture, Organizational Development, Organizational Structure, Executive Development, Knowledge management, Learning, Management Development, Trainability, Training Design, Training Evaluation, Training Methods, Transfer of Training "
1095,Onboarding and Training HR Talent,"8,24,37,42",video,Videos,2019,01/29/2020,01/29/2020,,https://youtu.be/IlYB7-KSBVc ,Onboarding and Training HR Talent,3802d6d1-f690-45ac-ae3e-62178f1644b8.jpg,Onboarding and Training HR Talent,http://est05.esalestrack.com/eSalesTrack/Content/Content.ashx?file=3802d6d1-f690-45ac-ae3e-62178f1644b8.jpg,0,"onboarding, training, training and development, talent, talent management"
1118,HR Rotational Programs ,"8,24,37,42",video,Videos,2020,02/14/2020,02/14/2020,,https://www.youtube.com/watch?v=bPnHo0feV6k&list=PLdvxLwoHBNn9s9l-VFBRBvU5j_kP4kw1k&index=13,,723967c7-0e7d-4bbc-8c93-2ffbb08d06ee.jpg,folder with people in it representing HR,http://est05.esalestrack.com/eSalesTrack/Content/Content.ashx?file=723967c7-0e7d-4bbc-8c93-2ffbb08d06ee.jpg,0,"Career management, Careers/Occupational Choice/Job Search (e.g., Career Success, Career Management, Career Development), Career Paths, Career Success, Coaching, Mentoring, Change Agents, Organizational Change Organizational Climate, Organizational Culture, Organizational Development, Organizational Structure, Executive Development, Knowledge management, Learning, Management Development, Trainability, Training Design, Training Evaluation, Training Methods, Transfer of Training"
1145,How Managerial Openness to Voice Shapes Internal Attraction ResearchBrief ,"8,24,37,47",pdf,Research Links,2020,02/24/2020,02/24/2020,7190927a-394e-4e30-960d-edf3bac93b46.pdf,http://est05.esalestrack.com/eSalesTrack/Content/Content.ashx?file=7190927a-394e-4e30-960d-edf3bac93b46.pdf,ResearchBrief about rejection and turnover in internal talent markets,,,http://est05.esalestrack.com/eSalesTrack/Content/Content.ashx?file=,0,"Affect/Emotions/Mood, Commitment, Employee Attitudes, Engagement, Involvement, Satisfaction, Conflict Management, Employee Relations, Employee Voice/participation, Meaning at Work, Psychological Contracts, Trust, Workplace Democracy  "
794,The Impact of Technology on HR,"8,24,37,50,52",link,Videos,2018,09/18/2018,10/04/2019,,https://www.cornell.edu/video/impact-of-technology-on-hr,The Impact of Technology on HR webcast,,The Impact of Technology on HR webcast,http://est05.esalestrack.com/eSalesTrack/Content/Content.ashx?file=,0,"HR, technology, future of work, artificial intelligence, machine learning, catbots"
1830,Targeted Benchmarking on HR Early Talent Rotational Programs,"8,24,39,47",pdf,Benchmarking,2022,01/17/2023,01/17/2023,10bc00fc-d7de-419a-ad91-578f18916ae0.pdf,https://est05.esalestrack.com/eSalesTrack/Content/Content.ashx?aid=2181&system_filename=10bc00fc-d7de-419a-ad91-578f18916ae0.pdf,,,,http://est05.esalestrack.com/eSalesTrack/Content/Content.ashx?file=,0,"HR, Early Talent, Rotational Programs"
1919,CAHRS Quarterly on Talent Management - Summer 2023,"8,24,40",pdf,News,2023,08/10/2023,08/10/2023,a82de992-c180-43ad-bc3c-4913ec8a652e.pdf,http://est05.esalestrack.com/eSalesTrack/Content/Content.ashx?file=a82de992-c180-43ad-bc3c-4913ec8a652e.pdf,,903e74ce-f806-4b0d-b977-f80f5a6b9bbf.jpg,talent management,http://est05.esalestrack.com/eSalesTrack/Content/Content.ashx?file=903e74ce-f806-4b0d-b977-f80f5a6b9bbf.jpg,2023,"talent management, learning, training"
1795,Hiring by Professional Affiliation: The Benefits and Challenges of Leveraging Prospective Hires Prior Employment Ties to Improve Matching and Access to Resources ResearchBrief,"8,24,40",pdf,Research Links,2022,12/06/2022,12/06/2022,a5bdb836-9292-4080-886b-1f0fcea3fe57.pdf,http://est05.esalestrack.com/eSalesTrack/Content/Content.ashx?file=a5bdb836-9292-4080-886b-1f0fcea3fe57.pdf,,,,http://est05.esalestrack.com/eSalesTrack/Content/Content.ashx?file=,0,"Attracting Talent, Attraction, HR Planning, Job Search, Labor Markets, Workforce Planning, Workforce Trends "
1871,The Diversity Heuristic: How Team Demographic Composition Influences Judgments of Team Creativity ResearchBrief ,"8,24,41",pdf,Research Links,2023,03/31/2023,03/31/2023,bb332c2f-9fee-424d-94e2-ed42e81184a6.pdf,http://est05.esalestrack.com/eSalesTrack/Content/Content.ashx?file=bb332c2f-9fee-424d-94e2-ed42e81184a6.pdf,,,,http://est05.esalestrack.com/eSalesTrack/Content/Content.ashx?file=,0,"teams and collaboration: group process, team composition, team dynamics, and virtual teams."
1116,Ideas for Further Exploration,"8,24,41,42",video,Videos,2020,02/14/2020,02/14/2020,,https://www.youtube.com/watch?v=nHdYKSjlgAw&list=PLdvxLwoHBNn9s9l-VFBRBvU5j_kP4kw1k&index=14,,b8eee60b-2da6-4596-b411-b8030f610884.jpg,lightbulb with a blooming plant inside of it,http://est05.esalestrack.com/eSalesTrack/Content/Content.ashx?file=b8eee60b-2da6-4596-b411-b8030f610884.jpg,0,"Career management, Careers/Occupational Choice/Job Search (e.g., Career Success, Career Management, Career Development), Career Paths, Career Success, Coaching, Mentoring, Change Agents, Organizational Change Organizational Climate, Organizational Culture, Organizational Development, Organizational Structure, Executive Development, Knowledge management, Learning, Management Development, Trainability, Training Design, Training Evaluation, Training Methods, Transfer of Training"
778,HR Shared Services: Models and Trends ,"8,28,37,52",video,Videos,2017,04/30/2018,10/04/2019,,https://www.youtube.com/watch?v=tCktQkazEv4&list=PLdvxLwoHBNn9s9l-VFBRBvU5j_kP4kw1k&t=343s&index=1,HR Shared Services: Models and Trends  webcast,95ca8eb4-7359-4d8e-90c9-52f0704994d1.jpg,a pyramid of round circles with stick figures on it,http://est05.esalestrack.com/eSalesTrack/Content/Content.ashx?file=95ca8eb4-7359-4d8e-90c9-52f0704994d1.jpg,0,"shared services, HR shared services, HRSS, trends, models, globalization, future of work, employee experience, metrics, agility, technology"
