resource_id,title,topic_ids,resource_format,resource_type,year,date_added,date_updated,pdf_upload,pdf_html_url,summary,thumbnail,thumbnail_alt_tag,thumbnail_url,issue_year,keywords
952,What is the Business Case For Using Assessment Tools in the External Selection Process For Executives?,"6,27,28",link,Student Papers,2016,05/01/2019,09/30/2019,,https://digitalcommons.ilr.cornell.edu/student/114/,student research answers the question What is the Business Case For Using Assessment Tools in the External Selection Process For Executives?,,student research answers the question What is the Business Case For Using Assessment Tools in the External Selection Process For Executives?,http://est05.esalestrack.com/eSalesTrack/Content/Content.ashx?file=,0,"360 Feedback, Appraisal Systems, Criterion Issues, Feedback, Performance Assessment, Performance Management, Talent Management "
982,What Metrics and Frameworks Best Calculate the ROI of Corporate Social Responsibility Activities in the Services Industry?,"6,27,28",link,Student Papers,2016,05/07/2019,09/30/2019,,https://digitalcommons.ilr.cornell.edu/student/99/,student research answers the question What Metrics and Frameworks Best Calculate the ROI of Corporate Social Responsibility Activities in the Services Industry?,,student research answers the question What Metrics and Frameworks Best Calculate the ROI of Corporate Social Responsibility Activities in the Services Industry?,http://est05.esalestrack.com/eSalesTrack/Content/Content.ashx?file=,0,"HR Metrics, Workforce Analytics, Corporate Social Responsibility, Retention "
1204,How is the Role of AI in Talent Acquisition Evolving?,"6,27,28",link,Student Papers,2019,04/23/2020,04/23/2020,,https://digitalcommons.ilr.cornell.edu/student/231,,,How is the Role of AI in Talent Acquisition Evolving?,http://est05.esalestrack.com/eSalesTrack/Content/Content.ashx?file=,0,"HR &amp; Technology, Automation, Robotics, Attracting Talent, Attraction, Workforce Trends "
1205,When is Psychometric Assessment a Reliable Tool for Candidate Selection?,"6,27,28",link,Student Papers,2019,04/23/2020,04/23/2020,,https://digitalcommons.ilr.cornell.edu/student/226,,,When is Psychometric Assessment a Reliable Tool for Candidate Selection?,http://est05.esalestrack.com/eSalesTrack/Content/Content.ashx?file=,0,"Employee Assessments, Assessment Centers, Employment tests, Screening, Selection methods, Selection validation "
1206,What Best Practices are Emerging to Understand and Measure Skills in the Talent Pool?,"6,27,28",link,Student Papers,2019,04/23/2020,04/23/2020,,https://digitalcommons.ilr.cornell.edu/student/207/,,,What Best Practices are Emerging to Understand and Measure Skills in the Talent Pool?,http://est05.esalestrack.com/eSalesTrack/Content/Content.ashx?file=,0,"Employee assessments, analytics, measurement, metrics"
1545,Intelligent Automation in Labor and Employee Relations: Existing and Potential Applications,"6,27,28",pdf,Student Papers,2021,05/20/2021,05/20/2021,525bda9c-f83c-4450-b048-7b3e0373f02b.pdf,http://est05.esalestrack.com/eSalesTrack/Content/Content.ashx?file=525bda9c-f83c-4450-b048-7b3e0373f02b.pdf,,,Intelligent Automation in Labor and Employee Relations: Existing and Potential Applications,http://est05.esalestrack.com/eSalesTrack/Content/Content.ashx?file=,0,Analytics Research Methods Measurement Statistical Techniques Metrics Innovation 
1680, What Capabilities for Data Analysis Should HRBPs Have? ,"6,27,28",link,Student Papers,2022,02/16/2022,02/06/2023,,https://ecommons.cornell.edu/handle/1813/110970,,,,http://est05.esalestrack.com/eSalesTrack/Content/Content.ashx?file=,0,"metrics, data, analytics"
648,The HR Function in 2021: Models and Competencies Webcast Slides,"6,27,28",pdf,Video Slides,2016,12/01/2016,10/07/2019,5ff6d0c4-99a9-4e49-831f-56392131189c.pdf,http://est05.esalestrack.com/eSalesTrack/Content/Content.ashx?file=5ff6d0c4-99a9-4e49-831f-56392131189c.pdf,The HR Function in 2021: Models and Competencies Webcast Slides,,The HR Function in 2021: Models and Competencies Webcast Slides,http://est05.esalestrack.com/eSalesTrack/Content/Content.ashx?file=,0,"analytics, metrics, HRBP, future of work, millennials, generational differences, multi-generational workforce, succession planning, HR function, future of the function, HR transformation, competency gaps"
1069,Examples of Connections Between HR Analytics and Business Outcomes,"6,27,28",video,Videos,2019,01/28/2020,01/28/2020,,https://youtu.be/GCOWbFJVQcI  ,Examples of Connections Between HR Analytics and Business Outcomes ,625b28d4-81b3-4148-a3e5-0ab54ee2db0f.jpg,Examples of Connections Between HR Analytics and Business Outcomes,http://est05.esalestrack.com/eSalesTrack/Content/Content.ashx?file=625b28d4-81b3-4148-a3e5-0ab54ee2db0f.jpg,0,"analytics, metrics, future of work"
1075,Examples of Predictive HR Analytics,"6,27,28",video,Videos,2019,01/28/2020,01/28/2020,,https://youtu.be/TvR2c6F4V8c ,Examples of Predictive HR Analytics,ead081ef-2d9f-4207-ae21-03feae0dd277.jpg,Examples of Predictive HR Analytics,http://est05.esalestrack.com/eSalesTrack/Content/Content.ashx?file=ead081ef-2d9f-4207-ae21-03feae0dd277.jpg,0,"analytics, metrics, tools"
1080,The Evolution of Workforce Analytics,"6,27,28",video,Videos,2019,01/28/2020,01/28/2020,,https://youtu.be/KQOUaDFZ9PI ,The Evolution of Workforce Analytics,abc3c720-4b2f-44f0-bbde-8c2e68fe5487.jpg,The Evolution of Workforce Analytics,http://est05.esalestrack.com/eSalesTrack/Content/Content.ashx?file=abc3c720-4b2f-44f0-bbde-8c2e68fe5487.jpg,0,"analytics, metrics, workforce analytics "
1081,Challenges with HR Analytics,"6,27,28",video,Videos,2019,01/28/2020,01/28/2020,,https://youtu.be/BdKZVaiVNhI ,Challenges with HR Analytics,fb0eecb4-80c8-456d-ba0d-3988a315976c.jpg,Challenges with HR Analytics,http://est05.esalestrack.com/eSalesTrack/Content/Content.ashx?file=fb0eecb4-80c8-456d-ba0d-3988a315976c.jpg,0,"analytics, metrics"
1082,How CAHRS Companies Are Investing and Leveraging Analytics,"6,27,28",video,Videos,2019,01/28/2020,01/28/2020,,https://youtu.be/EvwtjcAPS4I ,How CAHRS Companies Are Investing and Leveraging Analytics,61bc3312-fe4e-410d-bf94-184fa4854ea9.jpg,How CAHRS Companies Are Investing and Leveraging Analytics,http://est05.esalestrack.com/eSalesTrack/Content/Content.ashx?file=61bc3312-fe4e-410d-bf94-184fa4854ea9.jpg,0,"analytics, metrics"
1083,HR Analytics structure for your company,"6,27,28",video,Videos,2019,01/28/2020,01/28/2020,,https://youtu.be/TSnr4BEPyck,HR Analytics structure for your company,bbc02e57-2195-4801-ba6b-7e10c2798539.jpg,HR Analytics structure for your company,http://est05.esalestrack.com/eSalesTrack/Content/Content.ashx?file=bbc02e57-2195-4801-ba6b-7e10c2798539.jpg,0,"analytics, metrics"
1084,Shifting from Reporting to Drawing Insights from Analytics,"6,27,28",video,Videos,2019,01/28/2020,01/28/2020,,https://youtu.be/cIeRmbqD5L4 ,Shifting from Reporting to Drawing Insights from Analytics,7e698680-8619-4133-b922-ae8cdcc26855.jpg,Shifting from Reporting to Drawing Insights from Analytics,http://est05.esalestrack.com/eSalesTrack/Content/Content.ashx?file=7e698680-8619-4133-b922-ae8cdcc26855.jpg,0,"analytics, metrics"
1449,Diversity & Inclusion Analytics CAHRScast,"6,27,28",video,Videos,2021,02/23/2021,02/23/2021,,https://www.youtube.com/watch?v=tOlWWSzJT60&list=PLdvxLwoHBNn9s9l-VFBRBvU5j_kP4kw1k&index=1,,,Diversity & Inclusion Analytics ,http://est05.esalestrack.com/eSalesTrack/Content/Content.ashx?file=,0,"analytics, metrics"
611,HR for HR Summary Part 3,"6,27,28",pdf,Working Group Summaries,2016,06/23/2016,10/09/2019,5e7b3ae0-0287-4d85-9986-45cc622df218.pdf,https://est05.esalestrack.com/eSalesTrack/Content/Content.ashx?aid=2181&system_filename=5e7b3ae0-0287-4d85-9986-45cc622df218.pdf,HR for HR working group Summary Part 3,,HR for HR working group Summary Part 3,http://est05.esalestrack.com/eSalesTrack/Content/Content.ashx?file=,0,"HRBP, business partner, HR competencies, performance management, learning, learning and development, leadership development, talent management, HR generalist, analytics, metrics "
644,HR for HR Summary Part 4,"6,27,28",pdf,Working Group Summaries,2016,11/28/2016,10/07/2019,ee53fd56-83ae-4e2e-91ca-b97eefcd19f9.pdf,http://est05.esalestrack.com/eSalesTrack/Content/Content.ashx?file=ee53fd56-83ae-4e2e-91ca-b97eefcd19f9.pdf,HR for HR working group Summary Part 4,,HR for HR working group Summary Part 4,http://est05.esalestrack.com/eSalesTrack/Content/Content.ashx?file=,0,"HRBP, business partner, HR competencies, performance management, learning, learning and development, leadership development, talent management, HR generalist, analytics, metrics "
753,HR Analytics Summary Part 6,"6,27,28",pdf,Working Group Summaries,2017,01/02/2018,10/04/2019,3497c115-45a1-4469-bc3f-c37cdf03fb80.pdf,http://est05.esalestrack.com/eSalesTrack/Content/Content.ashx?file=3497c115-45a1-4469-bc3f-c37cdf03fb80.pdf,HR Analytics working group Summary Part 6,,HR Analytics working group Summary Part 6,http://est05.esalestrack.com/eSalesTrack/Content/Content.ashx?file=,0,"analytics, metrics, data, big data, quantitative, qualitative, turnover, performance management, talent, talent management, fit, workforce planning, future competency, knowledge, dashboards, HRBP, specialists, data collection"
756,Strategic Workforce Planning Summary (Part 2),"6,27,28",pdf,Working Group Summaries,2017,01/10/2018,10/04/2019,2926cb04-cc10-4bc3-be91-26b047874972.pdf,http://est05.esalestrack.com/eSalesTrack/Content/Content.ashx?file=2926cb04-cc10-4bc3-be91-26b047874972.pdf,Strategic Workforce Planning working group Summary (Part 2),,Strategic Workforce Planning working group Summary (Part 2),http://est05.esalestrack.com/eSalesTrack/Content/Content.ashx?file=,0,"strategic workforce planning, SWP, strategy, metrics, hr analytics, talent supply, bot, data, talent, pipeline, assessments, technology, methodology"
781,Strategic Workforce Planning ,"6,27,28",pdf,Working Group Summaries,2018,06/07/2018,10/04/2019,dbdaafeb-c960-4798-a1cd-97a6cb8317b2.pdf,https://est05.esalestrack.com/esalestrack/Content/Content.ashx?aid=2181&system_filename=dbdaafeb-c960-4798-a1cd-97a6cb8317b2.pdf,Strategic Workforce Planning  working group summary ,,Strategic Workforce Planning  working group summary ,http://est05.esalestrack.com/eSalesTrack/Content/Content.ashx?file=,0,"strategic workforce planning, workforce, SWP, HRBP, Human Resource Business Partner, data visualization tools, talent supply, capacity planning, headcount, analytics, predictive analytics, talent supply and demand"
1052,HR Technology ,"6,27,28",pdf,Working Group Summaries,2020,01/08/2020,01/13/2020,caae26d9-a350-46fa-8bdb-c628ba569d67.pdf,http://est05.esalestrack.com/eSalesTrack/Content/Content.ashx?file=caae26d9-a350-46fa-8bdb-c628ba569d67.pdf,,,HR Technology working group notes,http://est05.esalestrack.com/eSalesTrack/Content/Content.ashx?file=,0,"Automation, HR Information Systems, Technology, Robotics "
1414,Diversity & Inclusion Analytics ,"6,27,28",pdf,Working Group Summaries,2020,11/11/2020,11/11/2020,00481be8-1d94-411e-9570-0b6e160a898d.pdf,http://est05.esalestrack.com/eSalesTrack/Content/Content.ashx?file=00481be8-1d94-411e-9570-0b6e160a898d.pdf,,,diversity & inclusion analytics,http://est05.esalestrack.com/eSalesTrack/Content/Content.ashx?file=,0,"analytics, measurement, Qualitative research/grounded theory, metrics, organizational performance"
715,New Trends in People Analytics ,"6,27,28,29",pdf,Student Papers,2017,08/16/2017,10/07/2019,91b198ba-dbd8-4252-a6d1-763100e47e07.pdf,https://est05.esalestrack.com/esalestrack/Content/Content.ashx?aid=2181&system_filename=91b198ba-dbd8-4252-a6d1-763100e47e07.pdf,New Trends in People Analytics  student research,,New Trends in People Analytics  student research,http://est05.esalestrack.com/eSalesTrack/Content/Content.ashx?file=,0,"analytics, people analytics, data, quantified employees, sensors, open plan, social networking, consumer-driven HR, return on investment "
907,How do Organizations Measure the ROI or Impact of Leadership Training and Development Programs?,"6,27,28,29",link,Student Papers,2017,04/24/2019,10/02/2019,,https://digitalcommons.ilr.cornell.edu/student/156/,student research answers the question How do Organizations Measure the ROI or Impact of Leadership Training and Development Programs?,,student research answers the question How do Organizations Measure the ROI or Impact of Leadership Training and Development Programs?,http://est05.esalestrack.com/eSalesTrack/Content/Content.ashx?file=,0,"leadership, leadership development, return on investment, ROI, measurement, metrics, Basic Skills Training, Executive Development, Knowledge management, Learning, Management Development, Needs Assessment, Onboarding  , Trainabilit, Training Design Training Evaluation, Training Methods, Transfer of Training "
930,Can You Provide the Current Trends in HR on People Analytics?,"6,27,28,29",link,Student Papers,2017,04/25/2019,10/02/2019,,https://digitalcommons.ilr.cornell.edu/student/151/,students answer the question Can You Provide the Current Trends in HR on People Analytics?,,students answer the question Can You Provide the Current Trends in HR on People Analytics?,http://est05.esalestrack.com/eSalesTrack/Content/Content.ashx?file=,0,"analytics, HR analytics, trends, future function, HR Metrics, Workforce Analytics, Utility "
933,New Trends in People Analytics ,"6,27,28,29",link,Student Papers,2016,05/01/2019,10/02/2019,,https://digitalcommons.ilr.cornell.edu/student/141/,students research the topic New Trends in People Analytics ,,students research the topic New Trends in People Analytics ,http://est05.esalestrack.com/eSalesTrack/Content/Content.ashx?file=,0,"HR Metrics, Workforce Analytics "
1039,HR Analytics CAHRScast,"6,27,28,29",link,Videos,2019,09/18/2019,10/08/2019,,https://www.cornell.edu/video/hr-analytics-webcast-august-2019,HR analytics webinar ,dc895306-4738-4586-abaf-3e7adea7e94e.jpg,HR Analytics webcast ,http://est05.esalestrack.com/eSalesTrack/Content/Content.ashx?file=dc895306-4738-4586-abaf-3e7adea7e94e.jpg,0,"HR Analytics, metrics, data, technology "
1077,Examples of What Types of Data Should be Collected,"6,27,28,29",video,Videos,2019,01/28/2020,01/28/2020,,https://youtu.be/cgh1Oa5s29w ,Examples of What Types of Data Should be Collected,854e0579-afb4-47ad-abbd-2be1e0a625f5.jpg,Examples of What Types of Data Should be Collected,http://est05.esalestrack.com/eSalesTrack/Content/Content.ashx?file=854e0579-afb4-47ad-abbd-2be1e0a625f5.jpg,0,"analytics, metrics, tools, data"
1085,How Far Have Companies Progressed in HR Analytics?,"6,27,28,29",video,Videos,2019,01/28/2020,01/28/2020,,https://youtu.be/iMVgQ8mODbo,How Far Have Companies Progressed in HR Analytics?,f3692454-fc46-4f1e-99d3-7ef1a666f080.jpg,How Far Have Companies Progressed in HR Analytics?,http://est05.esalestrack.com/eSalesTrack/Content/Content.ashx?file=f3692454-fc46-4f1e-99d3-7ef1a666f080.jpg,0,"analytics, metrics"
707,HR Analytics Summary Part 5 ,"6,27,28,29",pdf,Working Group Summaries,2017,06/15/2017,10/07/2019,1b4afab5-de65-4b34-b9ce-6d76d3ff05f6.pdf,http://est05.esalestrack.com/eSalesTrack/Content/Content.ashx?file=1b4afab5-de65-4b34-b9ce-6d76d3ff05f6.pdf,HR Analytics working group Summary Part 5 ,,HR Analytics working group Summary Part 5 ,http://est05.esalestrack.com/eSalesTrack/Content/Content.ashx?file=,0,"strategy, analytics, talent, technology, data, artificial intelligence, machine learning, workforce management, skill inventories, skills assessment, social listening, SAS, storytelling"
1167,HR Analytics ,"6,27,28,29",pdf,Working Group Summaries,2020,03/05/2020,03/05/2020,6abbeeb5-c154-4626-b3dc-ecb2a5c9dcd5.pdf,http://est05.esalestrack.com/eSalesTrack/Content/Content.ashx?file=6abbeeb5-c154-4626-b3dc-ecb2a5c9dcd5.pdf,,,,http://est05.esalestrack.com/eSalesTrack/Content/Content.ashx?file=,0,"Analytics, Measurement, Metrics, Organizational Performance, Firm Performance "
950,HR Analytics: Talent Acquisition ,"6,27,48",link,Student Papers,2016,05/01/2019,09/30/2019,,https://digitalcommons.ilr.cornell.edu/student/143/,student research explores the topic HR Analytics: Talent Acquisition ,,student research explores the topic HR Analytics: Talent Acquisition ,http://est05.esalestrack.com/eSalesTrack/Content/Content.ashx?file=,0,"HR Metrics, Workforce Analytics, Screening, Selection methods, Selection validation, Testing "
1288,Targeted Benchmarking on Learning and Development Metrics,"6,28",pdf,Benchmarking,2019,06/25/2020,10/20/2020,938c1f71-8187-46ee-a9cd-089c0d177b5d.pdf,http://est05.esalestrack.com/eSalesTrack/Content/Content.ashx?aid=2181&system_filename=938c1f71-8187-46ee-a9cd-089c0d177b5d.pdf,,,Targeted Benchmarking on Learning and Development Metrics,http://est05.esalestrack.com/eSalesTrack/Content/Content.ashx?file=,0,"Leadership, learning, development, metrics, global, improvement"
1301,Targeted Benchmarking on TA Recruiting Metrics Within Pharmaceutical Companies,"6,28",pdf,Benchmarking,2019,06/26/2020,06/26/2020,ca87a989-8e5a-48d6-9715-87263b288df8.pdf,http://est05.esalestrack.com/eSalesTrack/Content/Content.ashx?aid=2181&system_filename=ca87a989-8e5a-48d6-9715-87263b288df8.pdf,,,Targeted Benchmarking on TA Recruiting Metrics Within Pharmaceutical Companies,http://est05.esalestrack.com/eSalesTrack/Content/Content.ashx?file=,0,"Recruiting, Metrics, Job Performance, Counterproductive Work Behaviors, Extra-Role Behaviors/OCBs , Creativity, Performance Measures/Criteria Issues "
1381,Targeted Benchmarking on Exit and Stay Interview Strategies,"6,28",pdf,Benchmarking,2020,10/02/2020,10/20/2020,6da2e223-1267-4958-8e78-7f13d314b323.pdf,http://est05.esalestrack.com/eSalesTrack/Content/Content.ashx?aid=2181&system_filename=6da2e223-1267-4958-8e78-7f13d314b323.pdf,,,Targeted Benchmarking on Exit and Stay Interview Strategies,http://est05.esalestrack.com/eSalesTrack/Content/Content.ashx?file=,0,"Exit, Stay, Interview, Strategies, mechanisms, survey, executives, diversity"
1477,How are HRBPs' Job Roles Changing due to Analytics and Insights and How can they Become Better Equipped to Handle the Transformation?,"6,28,48",link,Student Papers,2020,03/12/2021,03/12/2021,,https://ecommons.cornell.edu/handle/1813/102854,,,How are HRBPs' Job Roles Changing due to Analytics and Insights and How can they Become Better Equipped to Handle the Transformation?,http://est05.esalestrack.com/eSalesTrack/Content/Content.ashx?file=,0,"HRBP, HR Transformation "
1428,CAHRS Quarterly on HR Analytics/Metrics - Winter 2021,"6,48",pdf,News,2021,01/14/2021,01/14/2021,425f591c-8b3d-4103-8f7c-8ada2cccdb58.pdf,http://est05.esalestrack.com/eSalesTrack/Content/Content.ashx?file=425f591c-8b3d-4103-8f7c-8ada2cccdb58.pdf,,7e16c238-44d1-4b8b-b20c-1e33195d13f2.jpg,analytics quarterly,http://est05.esalestrack.com/eSalesTrack/Content/Content.ashx?file=7e16c238-44d1-4b8b-b20c-1e33195d13f2.jpg,2021,
1789,CAHRS Quarterly on HR Analytics/Metrics - Fall 2021,"6,48",pdf,News,2021,11/01/2022,11/01/2022,4477312f-e865-4d45-94c4-9f6ffff979b5.pdf,http://est05.esalestrack.com/eSalesTrack/Content/Content.ashx?file=4477312f-e865-4d45-94c4-9f6ffff979b5.pdf,,3ad8f004-f7bf-46eb-980e-74086719be63.jpg,analytics quarterly,http://est05.esalestrack.com/eSalesTrack/Content/Content.ashx?file=3ad8f004-f7bf-46eb-980e-74086719be63.jpg,2021,"analytics, metrics"
1478,How Should Companies Measure Success on Work-Life Balance and Employees' Well Being?,"6,48",link,Student Papers,2020,03/12/2021,03/12/2021,,https://ecommons.cornell.edu/handle/1813/102853,,,How Should Companies Measure Success on Work-Life Balance and Employees' Well Being?,http://est05.esalestrack.com/eSalesTrack/Content/Content.ashx?file=,0,"Metrics, well-being"
720,Ethical Change Management,"7,21,50,51",pdf,Student Papers,2017,08/16/2017,10/07/2019,aec9b71d-4d98-403f-be70-f1c2edab9db3.pdf,https://est05.esalestrack.com/esalestrack/Content/Content.ashx?aid=2181&system_filename=aec9b71d-4d98-403f-be70-f1c2edab9db3.pdf,Ethical Change Management student research,,Ethical Change Management student research,http://est05.esalestrack.com/eSalesTrack/Content/Content.ashx?file=,0,"ethics, change management, ethical, John Kotter, Kotter, coalition, climate, leaders, vision, strategy, ethos, empowerment, corporate social responsibility, CSR"
706,Learning and Development Summary Part 3,"7,22,34,35,37,39,41,42,47,52",pdf,Working Group Summaries,2017,06/15/2017,10/07/2019,fa8d4a6f-3f2a-467f-a7cb-11a6c2ec91e9.pdf,http://est05.esalestrack.com/eSalesTrack/Content/Content.ashx?file=fa8d4a6f-3f2a-467f-a7cb-11a6c2ec91e9.pdf,Learning and Development working group Summary Part 3,,Learning and Development working group Summary Part 3,http://est05.esalestrack.com/eSalesTrack/Content/Content.ashx?file=,0,"learning, development, innovation, agility, social platforms, communications, mobile learning, return of investment, ROI, digital marketing campaigns, self assessments, artificial intelligence, evaluation, training, knowledge management, performance management"
818,Don't Abandon the Water Cooler Yet: Flexible Work Arrangements and the Unique Effect of Face-to-Face Informal Communication on Idea Generation and Innovation,"7,34,35",pdf,Research Links,2018,11/26/2018,10/03/2019,6cda3542-a568-492d-aeda-3f6149eb8ae5.pdf,http://est05.esalestrack.com/eSalesTrack/Content/Content.ashx?file=6cda3542-a568-492d-aeda-3f6149eb8ae5.pdf,Don't Abandon the Water Cooler Yet: Flexible Work Arrangements and the Unique Effect of Face-to-Face Informal Communication on Idea Generation and Innovation ResearchLink,,Don't Abandon the Water Cooler Yet: Flexible Work Arrangements and the Unique Effect of Face-to-Face Informal Communication on Idea Generation and Innovation ResearchLink,http://est05.esalestrack.com/eSalesTrack/Content/Content.ashx?file=,0,"Contingent (Gig) Workers, Contracting/Contractors, Flexible Work Arrangements (Flextime/Flexplace), Outsourcing, Employee Involvement, Employee Satisfaction, Competencies (Knowledge/Skills), Employee Communications, Employee Voice/Participation, Managing Multi-cultural, Workforces/Teams, Effective Supervision, Organizational Culture, Organizational Learning, Counter-productive Work Behaviors, Wellness Programs, Work-life Balance/Integration, Team Dynamics/Processes (Communication, Decision-making, Etc.), Team Structures, Social Networks, Virtual Teams, Artificial Intelligence/Robotics Applications in HR, Distance Learning"
730,Consistent Drivers of Innovation Failure,"7,34,35",link,Videos,2017,08/16/2017,10/07/2019,,https://vod.video.cornell.edu/media/Consistent+Drivers+of+Innovation+Failure/1_wa9onr7l,Consistent Drivers of Innovation Failure video clip,,Consistent Drivers of Innovation Failure video clip,http://est05.esalestrack.com/eSalesTrack/Content/Content.ashx?file=,0,"innovation, change agent, strategy, communication, drivers, silos, commitment, leadership"
728,Recommendations: How HR Leaders Can be Innovation Change Agents,"7,34,35,50",link,Videos,2017,08/16/2017,10/07/2019,,https://vod.video.cornell.edu/media/Recommendations-+How+HR+Leaders+Can+be+Innovation+Change+Agents/1_pi6es7ra,Recommendations: How HR Leaders Can be Innovation Change Agents video clip,,Recommendations: How HR Leaders Can be Innovation Change Agents video clip,http://est05.esalestrack.com/eSalesTrack/Content/Content.ashx?file=,0,"innovation, change agent, strategy, alignment, talent management, culture, coaching, coach leader, talent management, assessments, rewards, incentives, knowledge, information sharing"
859,HR Shared Services: Models and Trends,"7,34,35,50",pdf,White Papers,2017,01/22/2019,03/05/2020,2792c1ad-afd6-40cb-9c92-9351c87dca80.pdf,http://est05.esalestrack.com/eSalesTrack/Content/Content.ashx?file=2792c1ad-afd6-40cb-9c92-9351c87dca80.pdf,HR Shared Services: Models and Trends White Paper,,HR Shared Services: Models and Trends White Paper,http://est05.esalestrack.com/eSalesTrack/Content/Content.ashx?file=,0,"HR shared services, total rewards, HRBP "
1105,HR Career Development in the Face of HR Transformation,"7,34,35,50",pdf,White Papers,2020,02/04/2020,02/12/2020,138f81e7-c9fa-4b6e-a7e5-aeedf98b60a5.pdf,http://est05.esalestrack.com/eSalesTrack/Content/Content.ashx?file=138f81e7-c9fa-4b6e-a7e5-aeedf98b60a5.pdf,,,HR transformation,http://est05.esalestrack.com/eSalesTrack/Content/Content.ashx?file=,0,"Career management, Careers/Occupational Choice/Job Search (e.g., Career Success, Career Management, Career Development), Career Paths, Career Success, Coaching, Mentoring, Change Agents, Organizational Change Organizational Climate, Organizational Culture, Organizational Development, Organizational Structure, Executive Development, Knowledge management, Learning, Management Development, Trainability, Training Design, Training Evaluation, Training Methods, Transfer of Training "
653,HR for R&D Working Group Summary,"7,34,35,50",pdf,Working Group Summaries,2016,01/03/2017,10/07/2019,e44c13f2-bd3f-493a-9e73-8b89dd46a94c.pdf,http://est05.esalestrack.com/eSalesTrack/Content/Content.ashx?file=e44c13f2-bd3f-493a-9e73-8b89dd46a94c.pdf,HR for R&D Working Group Summary,,HR for R&D Working Group Summary,http://est05.esalestrack.com/eSalesTrack/Content/Content.ashx?file=,0,"innovation, R&amp;D, research and development, technology business, future of work, HRBP, human resource business partner, pharmaceutical, retention, STEM, independent contractors, multi-generational employees, global, globalization"
